{
  "total_code": "class Solution:\n    def twoSum(self, nums: List[int], target: int) -> List[int]:\n        hashmap = {}\n        for i in range(len(nums)):\n            complement = target - nums[i]\n            if complement in hashmap:\n                return [i, hashmap[complement]]\n            hashmap[nums[i]] = i\n        # Return an empty list if no solution is found\n        return []",
  "analysis": "# Code Analysis Report\n\n## Quality Assessment\nHIGH\n\n## Overall Summary\nOverall, the code is of high quality with efficient logic and readability. However, there are some suggestions and potential optimizations that can be considered.\n\n## Logic Analysis\n- The code correctly implements the two-sum problem using a hashmap to store the complements of the target value.\n- The time complexity of the solution is O(n) where n is the number of elements in the input list.\n- The code handles the case where no solution is found by returning an empty list.\n\n## Suggested Improvements\n- Consider adding more descriptive comments to explain the purpose of the variables and the overall algorithm.\n- Type hinting is used properly, but consider adding more meaningful variable names for better understandability.\n- Ensure consistent naming conventions throughout the codebase.\n\n## Optimization Opportunities\n- One potential optimization could be to use a more descriptive variable name instead of 'hashmap' to improve code readability.\n- Another optimization could be to handle the case where multiple solutions exist for the two-sum problem. Currently, the code returns the first solution found, but it could be modified to return all possible solutions.\n\n*Analysis generated on 4/12/2025*",
  "raw_analysis": {
    "quality": "HIGH",
    "message": "Overall, the code is of high quality with efficient logic and readability. However, there are some suggestions and potential optimizations that can be considered.",
    "analysis": {
      "logic": [
        "The code correctly implements the two-sum problem using a hashmap to store the complements of the target value.",
        "The time complexity of the solution is O(n) where n is the number of elements in the input list.",
        "The code handles the case where no solution is found by returning an empty list."
      ],
      "suggestions": [
        "Consider adding more descriptive comments to explain the purpose of the variables and the overall algorithm.",
        "Type hinting is used properly, but consider adding more meaningful variable names for better understandability.",
        "Ensure consistent naming conventions throughout the codebase."
      ],
      "optimizations": [
        "One potential optimization could be to use a more descriptive variable name instead of 'hashmap' to improve code readability.",
        "Another optimization could be to handle the case where multiple solutions exist for the two-sum problem. Currently, the code returns the first solution found, but it could be modified to return all possible solutions."
      ]
    }
  },
  "timestamp": "2025-04-12T23:42:09.603Z"
}